Name,Email,Skills,ProjectIdea,Availability,PortfolioURL,AdditionalDetails
Shivam Sharma,shivam@example.com,"AI/ML,Frontend Development,Game Development",An AI assistant that understands emotions,flexible,https://github.com/shivamshar03,Looking for passionate AI/ML developers to collaborate on Anaya.
Aarav Mehta,aarav@example.com,"Backend Development,DevOps",SaaS tool for HR automation,flexible,https://portfolio-aarav.vercel.app,Need help building scalable backend APIs using Python and FastAPI.
Isha Verma,isha@example.com,"UI/UX Design,Frontend Development",Redesign a mental health app,flexible,https://dribbble.com/isha_designs,Seeking developers interested in mental health and UI/UX.
Nikhil Rao,nikhil@example.com,"Data Science,AI/ML",Chatbot for student feedback analysis,flexible,https://github.com/nikhil-ds,Let's build an intelligent bot that summarizes feedback in real time.
Priya Kapoor,priya@example.com,"Mobile Development,AR/VR",AR-based campus tour app,flexible,,I can work on frontend mobile UI. Looking for someone who can integrate AR features.
